{
    "schemaVersion": 1,
    "reportKind": "implementation-review",
    "reportId": "review-establish-local-agent-workflow-001",
    "changeId": "establish-local-agent-workflow",
    "reviewer": {
        "reviewerId": "fresh-reviewer-implementation-001",
        "role": "fresh-implementation-reviewer",
        "reviewedAt": "2026-07-24T14:00:00.000Z"
    },
    "workOrder": {
        "workOrderId": "integrate-establish-local-agent-workflow",
        "workOrderDigest": "f069f2746ac18f7720a8ac1742f042218af74e15da0d5e30a58b25c28c93659e"
    },
    "acceptedArtifactDigest": "60b1264fbd46be0374d6cb98a457f34fde08b5e2467a141f144bd2a2e6a30f2d",
    "git": {
        "baseSha": "25f75b2fd14bcafd7ff8ccb2ee2862a327e19416",
        "subjectSha": "f7e8b6d7a68294b9a2228ac5afb05a58cd769e1f",
        "subjectTreeSha": "67bec456108e1fd0453d75ed63e574fca3c0fa2d",
        "rawDiffSha256": "1d85dd413a4346ee00011e7ad474a1eb8ded91145e31b68189e7d6cece364307"
    },
    "scenarioMatrix": [
        {
            "requirement": "Reviews bind to exact implementation state",
            "scenario": "Exact passing review",
            "status": "pass",
            "evidence": [
                "The validator recomputed the work-order, artifact, commit, tree, and raw-diff identities."
            ]
        },
        {
            "requirement": "Repository verification is hermetic and non-source-modifying",
            "scenario": "Repository verification succeeds",
            "status": "pass",
            "evidence": [
                "The root verification command passed and its final inventory matched the starting state."
            ]
        }
    ],
    "conventionMatrix": [
        {
            "conventionId": "TOOL-01",
            "status": "pass",
            "evidence": ["Formatting checks passed for every changed JSON and JavaScript file."]
        },
        {
            "conventionId": "DOC-05",
            "status": "pass",
            "evidence": ["The implementation remains bound to the accepted active OpenSpec change."]
        }
    ],
    "fileOperations": {
        "additions": [
            ".agents/templates/integration-report.example.json",
            ".agents/templates/integration-report.schema.json",
            ".agents/templates/review-report.example.json",
            ".agents/templates/review-report.schema.json"
        ],
        "modifications": [],
        "deletions": [],
        "renames": []
    },
    "commands": [
        {
            "commandId": "verify-change",
            "cwd": ".",
            "executable": "npm",
            "arguments": ["run", "verify:change", "--", "establish-local-agent-workflow"],
            "exitCode": 0,
            "stdoutSha256": "63d42d26156fcc761e57da4128e9881d5bdf3bf933f0f6e9c93d6e26b9b90ae7",
            "stderrSha256": "7e6b710b765404cccbad9eedcff7615fc37b269d6db12cd81a58be541d93083c",
            "outcome": "pass"
        }
    ],
    "findings": [],
    "verdict": "pass",
    "acceptedRisks": []
}
